id,name
733328 ,邦特富邦75購01
734968 ,宜特國泰7B購01
734918 ,凱美永豐78購01
6419 ,京晨科
734917 ,立敦永豐78購01
731454 ,碩禾中信74購01
732481 ,胡連元大74購01
734686 ,大江群益77購01
734632 ,新普富邦77購01
734805 ,立敦統一7A購01
733994 ,網家永豐76購01
733963 ,榮剛元大76購01
734009 ,碩禾兆豐77購01
735485 ,碩禾群益79購01
732951 ,中美晶群益75購05
731788 ,譜瑞凱基76購01
733070 ,精材凱基75購03
735473 ,健亞永豐79購01
70746P ,聯亞群益78售05
732717 ,加百裕元富74購01
732798 ,金山電元大74購01
734068 ,宇峻永豐77購01
732961 ,大江凱基75購01
735881 ,群聯永豐7A購01
731546 ,康普國泰74購01
732428 ,穩懋國泰74購01
732678 ,萬潤兆豐74購01
735656 ,茂達日盛79購01
3624 ,光頡
00723B ,群益15年IG科技債
732827 ,僑威元大74購01
735564 ,大江中信79購01
733401 ,由田元大75購02
733993 ,原相永豐76購03
70829P ,信驊康和7A售02
732215 ,勝麗群益75購01
733844 ,東洋元大76購01
734522 ,胡連元大77購01
735432 ,聯亞元富79購01
70585P ,頎邦康和76售01
731950 ,凡甲元富74購01
3687 ,歐買尬
732766 ,群聯凱基74購01
733038 ,頎邦兆豐76購01
733066 ,譜瑞國票75購01
734196 ,美琪瑪台新78購01
733027 ,欣銓凱基75購01
734033 ,帛漢元大77購01
734297 ,富宇永豐77購01
733477 ,東洋兆豐76購01
735268 ,台半富邦7B購01
733203 ,晶焱日盛75購01
732400 ,昇達科群益75購01
5364 ,力麗店
735784 ,牧德元富79購01
70453P ,新漢康和74售02
8027 ,鈦昇
736051 ,中美晶統一7B購03
3226 ,至寶電
732737 ,群聯兆豐74購02
734420 ,三貝德日盛77購01
734284 ,迅得元大7A購01
70421P ,網家群益74售02
733091 ,金可元大75購02
735191 ,美琪瑪永豐78購02
8924 ,大田
70434P ,中美晶國泰74售03
733908 ,穩懋元大76購11
733321 ,神盾統一75購02
733702 ,英濟永豐76購01
732679 ,環球晶兆豐75購01
732601 ,譜瑞元大74購01
733166 ,同亨富邦75購01
734001 ,茂達凱基76購01
733609 ,宇峻群益77購01
732999 ,精測元大76購01
735960 ,金山電元大7A購01
733595 ,晶焱永豐76購01
70768P ,元太元大79售03
733105 ,精材台新77購01
3362 ,先進光
735669 ,東洋中信79購01
734592 ,牧德凱基77購02
730816 ,宜特元大74購01
733650 ,鈊象台新78購01
735727 ,中美晶元大79購06
731903 ,富喬元大76購01
733396 ,頎邦國票75購01
736023 ,東洋凱基7A購02
734329 ,智擎康和77購02
734557 ,良維凱基77購01
70816P ,網家元大79售04
734057 ,碩禾國泰7B購01
735737 ,宜鼎群益79購02
732536 ,中美晶凱基75購02
731478 ,金居國泰74購01
733341 ,恒耀永豐75購01
734285 ,帛漢元大77購02
734264 ,精材群益77購04
732555 ,精測元大74購03
732370 ,台半元大74購01
733131 ,先進光元大75購02
734932 ,凡甲凱基78購01
733103 ,環球晶永豐75購01
734858 ,凱美麥證78購01
732035 ,環球晶中信74購01
70800P ,雙鴻元大7A售01
70568P ,光燿科元大75售01
733061 ,聯合元大75購01
733444 ,頎邦永豐75購02
734501 ,環球晶凱基77購02
730675 ,來思達元大74購01
733772 ,精材統一77購01
70785P ,大江元大79售02
733442 ,環宇永豐75購02
70564P ,環球晶群益75售06
734762 ,富喬國泰78購01
4402 ,福大
732831 ,世界統一74購01
3623 ,富晶通
732442 ,環球晶統一74購05
735142 ,群聯永豐78購02
734975 ,僑威群益79購01
731589 ,康普元大75購01
733130 ,先進光元大75購01
735246 ,中美晶兆豐7A購02
731369 ,雙鴻國泰74購01
8354 ,冠好
732443 ,元太國票74購01
735883 ,環宇永豐7A購01
732929 ,原相元大78購01
735745 ,富宇永豐79購01
70640P ,群聯台新78售02
731638 ,精材元大74購01
2726 ,雅茗-KY
70432P ,精測元大75售01
70676P ,勝麗群益77售01
735445 ,信昌電國票79購01
731989 ,同致中信77購01
734153 ,大地永豐77購01
733118 ,良維國泰77購02
734294 ,牧德永豐77購03
733343 ,網家日盛76購01
733051 ,頎邦日盛75購01
735651 ,台星科康和79購02
732803 ,群聯日盛74購01
733136 ,雙鴻元大78購01
734732 ,昂寶群益77購04
732955 ,朋程元大75購01
70637P ,頎邦富邦76售02
735208 ,直得凱基78購01
70385P ,元太富邦74售01
732003 ,環球晶統一74購02
731739 ,精材中信75購01
732492 ,穩懋群益74購06
732883 ,聯亞永豐75購01
733915 ,碩禾永豐76購01
733380 ,昂寶元大76購02
70482P ,穩懋兆豐75售01
736079 ,凱美永豐7A購01
733642 ,環球晶國泰76購01
733404 ,昂寶元大75購02
70661P ,合晶永豐77售01
70459P ,威剛元大75售02
732791 ,大中永豐74購02
734565 ,環球晶元大77購05
735310 ,雙鴻元富79購01
70541P ,神盾凱基75售05
2061 ,風青
735955 ,晶焱群益7B購01
732845 ,茂達日盛77購01
733938 ,中美晶元富76購01
733967 ,美琪瑪統一76購01
732826 ,台半元大75購01
735505 ,新普永豐79購01
733425 ,江興鍛元富75購01
733569 ,凱美永豐76購01
733897 ,金可凱基76購02
732433 ,環球晶富邦74購01
5438 ,東友
733114 ,岳豐國泰76購02
734325 ,博智國泰77購01
734094 ,環球晶兆豐79購01
733904 ,精華元富76購01
70547P ,穩懋統一75售02
736035 ,世界群益7A購01
735148 ,勝麗富邦78購02
731984 ,環宇群益74購03
735810 ,恒耀元大79購02
70498P ,穩懋凱基75售02
734408 ,元太群益77購02
5314 ,世紀
732541 ,僑威日盛74購01
732623 ,聯亞群益74購01
732567 ,精華永豐74購01
733593 ,牧德永豐76購01
732846 ,閎康日盛74購01
734586 ,牧德國泰77購01
733354 ,光燿科富邦79購01
732518 ,胡連元大74購02
70808P ,欣銓元大79售01
734977 ,金居元大79購01
70814P ,台半元大79售05
8440 ,綠電
732375 ,穩懋元大74購02
734785 ,宇峻元富78購01
732432 ,統新永豐74購01
734367 ,群聯凱基77購03
732644 ,凡甲永豐74購02
732843 ,宜特元大74購02
733326 ,雙鴻元大78購02
735163 ,應華元大7A購01
735760 ,直得元富79購01
3465 ,祥業
732234 ,穩懋元大75購01
734756 ,昂寶群益77購05
3374 ,精材
732207 ,精材凱基75購02
735828 ,精華群益79購03
733773 ,同致第一79購01
4174 ,浩鼎
70419P ,中美晶群益75售04
732227 ,譜瑞群益75購01
733421 ,頎邦富邦76購01
734141 ,千如群益77購01
733850 ,泰博日盛76購01
733336 ,先進光永豐75購02
732701 ,環宇元大74購01
734833 ,原相凱基78購01
5703 ,亞都
734265 ,環球晶群益77購01
736216 ,晶焱永豐7A購02
733206 ,聯亞兆豐76購01
733889 ,金可永豐76購02
733624 ,合晶永豐76購02
735678 ,中美晶富邦79購03
5403 ,中菲
732875 ,原相元富77購01
733367 ,環球晶凱基75購05
735937 ,廣明永豐7A購01
732570 ,岳豐日盛74購01
734266 ,環球晶群益77購02
8171 ,天宇
3276 ,宇環
70813P ,中美晶永豐79售04
734773 ,博智元大77購03
732687 ,精測永豐74購02
733277 ,神盾元大76購01
734796 ,碩禾凱基78購01
70804P ,環球晶元富79售02
733668 ,先進光國泰76購01
70549P ,環球晶元大75售06
70828P ,聯亞群益7A售05
70530P ,群聯元大75售04
70604P ,先進光康和76售01
729766 ,同致元大75購01
732164 ,精材凱基74購02
70797P ,穩懋元大79售02
8077 ,洛碁
70745P ,碩禾群益7A售01
3211 ,順達
731844 ,光燿科兆豐74購01
70650P ,群聯群益77售02
732788 ,美磊群益74購01
732494 ,鈊象群益75購01
732945 ,翔名國泰75購01
735804 ,恒耀永豐79購01
735909 ,均豪元富84購01
01103S ,991中租賃A
734056 ,美琪瑪國泰77購01
70596P ,精華元大76售03
70435P ,中美晶國泰76售03
734242 ,精測永豐77購01
735173 ,群聯統一78購02
735773 ,元太元大79購06
732117 ,網家群益74購01
70454P ,原相凱基74售01
734927 ,江興鍛元富78購01
733822 ,IET元大76購02
732539 ,穩懋凱基74購10
70634P ,精材元大77售02
733418 ,環球晶兆豐75購03
733242 ,神盾元大75購02
735561 ,世界元富79購01
735232 ,東洋麥證7A購01
733489 ,頎邦永豐75購04
735214 ,中光電永豐79購01
736209 ,大中永豐7A購01
732458 ,由田群益74購01
732776 ,中美晶中信74購04
733240 ,大中元大77購01
4183 ,福永生技
731421 ,金居元大75購01
733451 ,穩懋群益75購06
70519P ,穩懋台新75售03
733560 ,金山電凱基76購01
734976 ,久元元大78購02
70410P ,穩懋兆豐74售02
732973 ,聯亞永豐75購02
70712P ,群聯群益79售01
733405 ,昇達科元大75購03
70577P ,凡甲康和76售01
733538 ,金居統一76購01
6530 ,創威
732815 ,宜特國泰75購02
733198 ,昂寶元大75購01
70718P ,環球晶元富77售05
735893 ,中美晶富邦7A購01
70611P ,穩懋元大76售05
733304 ,精華凱基75購03
70806P ,台半康和79售01
734504 ,環球晶凱基77購05
733737 ,穩懋康和76購01
732133 ,精測群益74購01
732171 ,凡甲元大74購02
70488P ,頎邦凱基75售02
734737 ,應華永豐77購02
734955 ,環球晶統一7A購01
735037 ,網家群益79購03
733974 ,美琪瑪凱基77購02
733551 ,岳豐日盛76購01
735944 ,金居元富7A購01
733881 ,凱美第一79購01
733806 ,宜特國泰7A購01
735736 ,先進光群益7A購01
733847 ,群聯元大76購03
734467 ,久元元大77購01
733069 ,東洋凱基75購01
2924 ,東凌-KY
733431 ,宇峻元大75購01
70466P ,中美晶統一75售01
732908 ,勝麗元大75購02
732851 ,昇達科國泰75購01
4413 ,飛寶企業
733332 ,群聯群益76購01
733879 ,威剛群益77購01
735796 ,立敦永豐79購01
734071 ,中美晶台新78購01
734884 ,迅得元富7B購01
736127 ,信昌電國泰7C購01
70834P ,精測元大7A售02
5516 ,雙喜
735997 ,泰博元大7A購01
70424P ,碩禾群益75售01
734769 ,宇峻元大78購01
734074 ,大中群益78購01
733610 ,威剛永豐76購02
735877 ,岳豐永豐7A購01
70811P ,穩懋群益79售06
735023 ,牧德凱基78購01
733577 ,恒耀元大76購01
734881 ,台燿凱基78購01
733614 ,聯亞元大78購01
734207 ,欣銓富邦79購01
734307 ,牧德凱基77購01
734003 ,環球晶富邦77購01
735157 ,力旺凱基78購01
5481 ,華韡
731048 ,同致國泰74購01
734309 ,威剛兆豐78購01
70633P ,台燿元富76售01
733740 ,岳豐凱基76購02
733029 ,精華凱基75購01
735861 ,大田元大79購03
70002X ,世界元大63展02
732533 ,鼎翰群益74購01
8279 ,生展
4160 ,創源
70395P ,穩懋群益74售03
733046 ,弘塑群益75購01
733423 ,精材凱基75購07
733718 ,穩懋台新78購01
734202 ,原相元富77購02
730905 ,鈊象元大74購02
734319 ,直得統一77購01
736068 ,桓達元大7A購01
735355 ,精材日盛79購01
733530 ,精材凱基76購01
3537 ,堡達
9962 ,有益
731940 ,光燿科群益74購01
734198 ,凡甲元富77購01
733756 ,亞泰永豐76購01
732943 ,網家凱基75購02
70820P ,穩懋兆豐79售04
733771 ,精測日盛76購01
733461 ,頎邦永豐75購03
735183 ,金居兆豐7A購01
735534 ,勝麗中信79購01
70729P ,穩懋富邦77售03
734606 ,群聯元大78購01
734998 ,宇峻永豐78購02
70699P ,聯亞群益78售03
70480P ,中美晶日盛75售01
70758P ,鈊象康和78售01
733139 ,直得第一75購01
735362 ,萬潤凱基79購01
733276 ,泰博元大75購01
732528 ,中美晶群益74購05
731354 ,廣明凱基75購02
1787 ,福盈科
6123 ,上奇
732680 ,中美晶永豐74購05
735326 ,網家凱基79購01
5016 ,松和
734262 ,原相群益77購01
734662 ,新普凱基77購01
735869 ,中天群益7A購01
5490 ,同亨
734817 ,原相永豐78購01
734064 ,聚和凱基77購01
732452 ,環球晶凱基74購02
735992 ,中天元大7A購01
733351 ,東洋元大75購01
734991 ,智擎麥證79購01
732662 ,元太兆豐75購02
735586 ,大田康和79購01
70457P ,穩懋元大74售09
735385 ,聖暉國票79購01
735587 ,同致永豐79購01
732985 ,新普元富75購01
732829 ,聯亞元大74購01
735540 ,昂寶凱基79購01
733445 ,碩禾國泰77購02
734292 ,雙鴻元大79購01
5299 ,杰力
70250P ,雙鴻群益74售01
732407 ,元太元大74購04
733193 ,鈊象國票75購01
733121 ,原相日盛75購01
736115 ,朋億群益7B購01
732673 ,中美晶富邦74購02
734722 ,環球晶兆豐78購01
735826 ,光頡群益79購01
735674 ,碩禾凱基7A購01
735050 ,朋程麥證78購01
732221 ,東隆興元大77購01
732992 ,環球晶群益75購03
734485 ,精測群益77購01
733552 ,同致統一78購01
3162 ,精確
733400 ,精材凱基75購06
1799 ,易威
733101 ,新漢永豐75購01
732462 ,譜瑞群益75購03
735801 ,勝麗永豐79購01
734131 ,信昌電第一77購01
734517 ,力旺元大77購02
70842P ,台燿元大7A售01
70159P ,同致元大74售02
735318 ,台半凱基79購01
4711 ,永純
733669 ,威剛國泰79購01
733529 ,昂寶凱基76購01
733020 ,協益永豐75購01
734429 ,穩懋台新77購01
734310 ,原相永豐77購02
733937 ,應華國泰78購01
733943 ,富喬永豐76購02
732391 ,元太國泰74購01
4974 ,亞泰
732778 ,台半國泰75購01
736031 ,群聯富邦7B購01
732659 ,精材元大75購04
734655 ,元太元大77購01
3306 ,鼎天
735396 ,合晶群益7A購01
732930 ,閎康元大75購01
734736 ,威剛永豐77購02
732502 ,中美晶永豐74購03
735860 ,精測永豐79購03
3541 ,西柏
734031 ,中美晶宏遠77購01
8042 ,金山電
733861 ,信昌電元富77購01
733808 ,同致富邦7B購01
5344 ,立衛
733100 ,柏文永豐75購01
70845P ,碩禾元大7A售02
735185 ,群聯兆豐79購01
730648 ,宏觀國泰74購01
4127 ,天良
735434 ,頎邦元富79購03
734678 ,環球晶元大77購09
734984 ,東洋麥證79購01
70527P ,元太凱基75售02
735743 ,美琪瑪永豐79購01
734656 ,環球晶元大77購08
732406 ,元太元大74購03
735345 ,網家群益79購04
734734 ,IET永豐77購01
3310 ,佳穎
732228 ,同致國泰78購01
732254 ,伍豐元富75購01
733653 ,VHQ凱基76購01
734079 ,新普群益77購01
735935 ,金可永豐7A購01
734684 ,精測台新79購02
733462 ,合晶元富75購02
5426 ,振發
734628 ,久元統一77購02
3265 ,台星科
736157 ,朋億群益7B購02
736175 ,恒耀永豐7A購01
733085 ,聖暉永豐75購01
734610 ,牧德永豐77購06
733627 ,穩懋群益76購03
733457 ,牧德永豐75購02
735420 ,IET元大79購01
733699 ,茂達國票76購01
736053 ,世界統一7C購01
733853 ,群聯統一77購01
8040 ,九暘
735657 ,中美晶台新79購01
734154 ,禾瑞亞永豐77購01
734970 ,牧德永豐78購02
8941 ,關中
3293 ,鈊象
4543 ,萬在
70643P ,精華凱基76售01
735496 ,穩懋富邦7A購02
4432 ,銘旺實
733306 ,聯亞凱基75購01
734382 ,三貝德國泰79購01
70642P ,元太富邦77售01
732683 ,威剛永豐74購02
735274 ,岳豐永豐79購01
734416 ,原相中信79購01
734312 ,千附群益77購01
70824P ,合晶日盛79售03
733715 ,原相富邦77購01
733048 ,網家群益76購02
735956 ,譜瑞群益7A購02
733134 ,網家元大76購02
730581 ,雙鴻國泰77購01
734839 ,元太統一78購02
8109 ,博大
734878 ,環宇永豐78購01
6560 ,欣普羅
70851P ,精測群益7B售02
733713 ,群聯日盛76購01
70561P ,原相元大76售02
733714 ,威剛富邦78購01
3202 ,樺晟
735673 ,同致凱基79購01
732734 ,邦特日盛74購01
732677 ,譜瑞日盛74購01
734790 ,信昌電元大78購02
732686 ,順達永豐74購02
5304 ,鼎創達
734636 ,環球晶群益77購06
735800 ,桓達永豐79購01
734530 ,原相國泰77購02
735746 ,應華永豐79購01
8291 ,尚茂
735270 ,譜瑞富邦79購01
70392P ,環球晶凱基74售05
5340 ,建榮
734403 ,鼎翰元大77購01
733241 ,宜鼎元大75購02
70754P ,穩懋兆豐78售02
732543 ,精測日盛75購01
732671 ,勝麗中信74購01
734560 ,中美晶群益78購02
733016 ,聯亞群益75購01
70736P ,新普群益78售01
733322 ,網家兆豐76購01
733914 ,富喬永豐76購01
732993 ,大江元大75購03
733169 ,群聯元富77購01
6486 ,互動
735038 ,譜瑞群益78購01
733331 ,神盾中信75購01
731088 ,岳豐凱基74購03
732480 ,欣銓元大74購01
735033 ,神盾永豐78購01
735905 ,網家中信7A購01
733965 ,美琪瑪日盛76購01
731949 ,原相統一74購02
735562 ,神盾元富7A購01
70552P ,神盾群益75售03
732318 ,中美晶群益75購02
735382 ,精測群益79購01
734149 ,精材群益77購02
734929 ,台半康和78購01
734798 ,富喬富邦79購01
732880 ,雙鴻凱基76購01
735744 ,博智永豐79購01
70412P ,威剛永豐74售01
734564 ,昂寶元大77購01
732356 ,中美晶國泰76購01
735718 ,中美晶凱基79購04
733057 ,合晶元大76購01
733310 ,譜瑞凱基75購04
733386 ,網家群益76購03
735403 ,伍豐麥證79購01
733383 ,大江群益75購01
733235 ,神盾凱基75購01
735647 ,穩懋麥證79購02
734108 ,金居群益77購02
734435 ,中天永豐77購01
732420 ,聯亞台新75購01
734490 ,光頡國泰79購01
732379 ,宇峻群益74購02
70495P ,台半群益76售01
733562 ,精華元大76購01
731759 ,雙鴻國泰75購01
735155 ,聖暉玉山7C購01
735668 ,中美晶元富79購01
734755 ,同致群益77購02
735156 ,環球晶群益78購03
70506P ,威剛凱基75售01
732722 ,茂達永豐74購02
734964 ,三貝德群益78購02
734481 ,穩懋永豐77購03
734943 ,長華科麥證78購01
70594P ,穩懋國票76售01
732712 ,群聯群益74購02
735043 ,應華元大78購02
3313 ,斐成
732764 ,良維凱基74購03
733494 ,台燿群益75購01
731987 ,昂寶凱基75購01
734683 ,恒耀永豐77購01
70674P ,合晶元大77售02
734251 ,大江元富77購01
733929 ,智擎永豐76購01
732848 ,中美晶兆豐75購02
70628P ,頎邦群益76售01
735478 ,精測元富79購01
732468 ,璟德永豐74購01
733395 ,新普第一75購01
733518 ,昂寶台新79購01
70599P ,群聯兆豐76售02
733678 ,頎邦凱基76購01
5523 ,豐謙
733255 ,精材富邦76購01
734602 ,聯亞群益78購04
733113 ,同致國泰76購01
732627 ,碩禾元大76購03
3438 ,類比科
70306P ,精材中信77售01
734106 ,波若威群益78購01
732575 ,中美晶群益75購03
735133 ,譜瑞兆豐79購01
735923 ,環球晶凱基7A購04
734689 ,僑威群益77購02
733365 ,頎邦永豐75購01
731810 ,譜瑞凱基77購01
735224 ,中美晶群益7A購02
735107 ,朋程元大78購01
735688 ,伍豐元大79購01
734344 ,久元元富77購01
735041 ,岳豐元大79購01
734055 ,頎邦富邦77購02
70504P ,大江元大75售04
70646P ,譜瑞元富76售02
70003X ,新普元大63展02
734300 ,環球晶永豐77購01
3285 ,微端
735574 ,宇隆日盛79購01
735129 ,聯亞群益79購01
733432 ,原相元大77購03
735679 ,勝麗富邦7A購01
733460 ,廣明永豐75購01
734447 ,中天日盛77購01
70738P ,牧德康和78售01
732486 ,大田群益74購02
2221 ,大甲
733878 ,原相中信78購01
734092 ,金可兆豐77購01
733006 ,力旺元富75購01
734627 ,久元統一77購01
731866 ,光燿科凱基76購02
733704 ,穩懋永豐76購02
733190 ,中美晶第一75購01
70635P ,穩懋元富76售01
733876 ,千附日盛76購01
734038 ,精華元大77購01
3339 ,泰谷
732581 ,信昌電兆豐74購01
4420 ,光明
734205 ,大地康和77購01
734037 ,群聯元大77購02
733086 ,精華永豐75購01
733271 ,應華凱基75購01
735312 ,譜瑞中信79購01
6234 ,高僑
734849 ,三貝德麥證78購01
734827 ,宜特群益78購01
732562 ,富喬元富74購01
733111 ,金可元富75購01
4939 ,亞電
734759 ,穩懋群益77購06
70693P ,原相凱基77售03
732707 ,加百裕群益74購01
733608 ,群聯玉山79購01
70478P ,穩懋元富75售02
732897 ,頎邦台新76購01
734171 ,合晶元大78購01
733872 ,IET永豐76購02
734635 ,勝麗群益78購03
733471 ,環球晶元大75購07
732475 ,金居兆豐75購01
731450 ,碩禾國泰78購01
732590 ,先豐元富74購01
4130 ,健亞
734080 ,精材群益77購01
734201 ,岳豐元富77購01
733891 ,陽程元富76購01
734120 ,統新永豐77購01
733758 ,勝麗永豐76購02
735888 ,大田凱基7A購01
733779 ,波若威永豐76購01
732266 ,帛漢群益75購01
732382 ,胡連群益74購01
734727 ,碩禾群益77購01
734612 ,信昌電永豐77購02
733782 ,皇田元大76購01
733776 ,金可凱基76購01
732997 ,翔名元大78購01
70675P ,良維元大77售02
70497P ,譜瑞元大75售02
735429 ,鈊象富邦7A購01
734410 ,穩懋群益77購02
733330 ,先進光中信77購01
732874 ,伍豐國泰76購01
732301 ,萬潤國泰76購01
734452 ,VHQ國泰78購01
733786 ,譜瑞元大76購03
734223 ,合晶群益78購01
70638P ,碩禾元大79售02
732580 ,譜瑞台新74購01
732187 ,精材元富76購01
733681 ,群聯永豐76購04
70493P ,穩懋元大75售03
734010 ,聖暉康和77購01
733490 ,精材富邦75購01
70334P ,環球晶群益74售02
6125 ,廣運
733300 ,智擎台新78購01
733389 ,旺矽元富75購01
734589 ,晶焱康和77購01
732439 ,穩懋玉山77購01
732421 ,穩懋台新74購02
733013 ,大江國票75購01
733372 ,威剛統一75購02
735317 ,大江凱基79購02
734316 ,VHQ元富77購01
733565 ,神盾富邦7C購01
4944 ,兆遠
733582 ,宜鼎國票76購01
734090 ,元太兆豐78購01
735364 ,大田永豐79購01
732635 ,宜鼎國票74購01
735755 ,良維元大7C購01
733586 ,牧德兆豐76購01
733218 ,泰博永豐75購01
733368 ,雙鴻凱基77購01
733671 ,明安元富76購01
734669 ,原相康和77購01
735045 ,鈊象元大78購01
732516 ,金居元大75購02
734879 ,鈊象永豐78購01
731284 ,美琪瑪元大75購01
735785 ,中美晶群益79購06
734704 ,勝麗富邦78購01
732615 ,精測富邦74購01
734151 ,凡甲永豐77購01
3232 ,昱捷
736040 ,美琪瑪群益7A購02
733995 ,久元康和76購01
732690 ,迅得群益75購01
735598 ,中光電統一79購02
4429 ,聚紡
732660 ,精材元大75購05
735011 ,東洋元大78購01
733509 ,直得凱基75購01
70827P ,譜瑞元大7A售01
70846P ,力麒康和7A售02
733207 ,元太國泰75購01
735402 ,元太麥證7A購01
731453 ,同致中信76購01
732780 ,穩懋國泰74購03
734191 ,中美晶元大77購01
4953 ,緯軟
732949 ,精華元富75購01
735646 ,環球晶元富79購01
70400P ,穩懋永豐74售02
70777P ,合晶凱基79售03
735906 ,恒耀中信7A購01
732870 ,金居永豐75購01
734227 ,精材凱基77購01
732505 ,胡連永豐74購01
732761 ,群聯元大74購02
735233 ,欣銓麥證7A購01
734121 ,精材永豐77購01
733063 ,同致國票75購01
732676 ,勝麗日盛74購01
6179 ,亞通
731746 ,台燿凱基76購01
735700 ,信昌電群益7A購01
733267 ,凡甲第一75購01
734013 ,原相凱基77購01
734543 ,信驊永豐77購02
70648P ,威剛日盛76售02
735722 ,合晶凱基79購05
735680 ,欣銓日盛79購01
1591 ,駿吉-KY
735344 ,昂寶群益79購01
733090 ,昇達科元大75購02
733324 ,神盾元大75購03
732476 ,精測兆豐75購01
733161 ,先進光國泰75購01
733820 ,聯亞元富76購01
70713P ,東洋凱基77售03
733244 ,網家元大75購04
732777 ,智擎中信75購01
734058 ,頎邦中信79購02
732882 ,富喬永豐75購01
732192 ,同致兆豐74購01
733517 ,凱美群益76購01
734598 ,新普群益77購02
733720 ,昂寶群益76購01
732987 ,碩禾元富75購01
734070 ,金居永豐77購01
731920 ,穩懋凱基74購08
732459 ,合晶群益75購01
735892 ,頎邦凱基7A購01
734133 ,聯亞日盛77購01
736144 ,鈊象元大7A購02
734275 ,久元日盛77購01
733072 ,穩懋凱基75購04
735053 ,胡連麥證79購01
3551 ,世禾
735464 ,台半國票79購01
733021 ,昂寶永豐75購01
735193 ,環宇永豐78購02
734122 ,龍巖永豐77購01
735952 ,展旺群益7A購01
735370 ,凱美元富79購02
733360 ,環球晶玉山79購01
732584 ,中美晶統一74購06
70832P ,環球晶凱基7A售06
732363 ,中美晶國票74購01
733936 ,應華國泰76購01
734713 ,良維元大77購04
734767 ,岳豐玉山77購01
733142 ,先進光凱基75購01
2719 ,燦星旅
8432 ,東生華
730714 ,威剛元大74購01
736103 ,川寶永豐7A購01
734566 ,聯合元大77購01
735106 ,昂寶元大78購02
734840 ,元太統一78購03
70705P ,美琪瑪群益78售01
734192 ,台燿元大77購01
734015 ,網家凱基77購01
733859 ,信昌電國泰77購01
734343 ,網家兆豐77購01
732006 ,大江兆豐74購01
732317 ,中美晶群益75購01
70629P ,精材永豐76售02
734593 ,勝麗台新78購01
734996 ,恒耀麥證79購01
733997 ,元太康和76購01
732797 ,東洋元大74購02
733875 ,應華永豐76購01
734268 ,頎邦台新77購02
735876 ,世界永豐7A購01
734097 ,合晶國泰77購01
732669 ,穩懋兆豐74購03
70597P ,穩懋富邦78售01
3322 ,建舜電
735411 ,西柏元富79購01
734423 ,聖暉統一77購02
734983 ,宇隆麥證78購01
736085 ,同致中信7C購01
4971 ,IET-KY
733801 ,聚和群益76購01
736021 ,世界凱基7B購01
70415P ,譜瑞元富74售01
734036 ,順達元大77購01
734356 ,千附統一77購01
70408P ,中美晶凱基74售05
735304 ,閎康元大79購01
734540 ,東洋凱基77購02
70680P ,中美晶中信77售01
732618 ,大宇資群益74購01
734474 ,金居群益77購03
733352 ,原相元大76購01
733524 ,穩懋永豐76購01
6227 ,茂綸
733571 ,IET元大76購01
8049 ,晶采
733252 ,先進光日盛75購01
70660P ,精材國泰77售01
735367 ,東洋兆豐79購01
732272 ,頎邦兆豐75購01
734654 ,中美晶元大77購06
735838 ,原相麥證79購01
734954 ,牧德統一78購01
734567 ,穩懋元大77購09
2643 ,捷迅
735984 ,昂寶元富7A購01
3287 ,廣寰科
734208 ,群聯富邦77購01
732840 ,大中群益74購04
735422 ,勝麗元大7B購01
735886 ,宣德元大7A購01
70822P ,大田康和79售02
734278 ,璟德富邦77購01
735753 ,合晶統一7A購03
733590 ,神盾群益76購01
733922 ,昂寶群益76購02
734990 ,凱美麥證79購01
2233 ,宇隆
70458P ,環球晶統一74售07
732113 ,元太群益74購03
732609 ,精測中信75購03
736173 ,智冠永豐7A購02
730666 ,環球晶永昌75購02
733335 ,世界永豐75購02
736128 ,高技國泰7A購01
734894 ,頎邦兆豐78購01
734596 ,信昌電群益77購01
733266 ,元太元富75購01
733480 ,穩懋兆豐76購01
733135 ,環球晶元大75購03
8930 ,青鋼
732718 ,順達元富74購01
732563 ,鈊象富邦76購01
733528 ,立敦凱基76購01
733831 ,碩禾台新77購01
733374 ,環球晶統一76購02
733729 ,穩懋永豐76購03
70815P ,昂寶元大79售03
736145 ,力麒康和7A購01
733573 ,立端元大76購01
732752 ,博智群益74購01
733578 ,環球晶日盛76購01
70805P ,中美晶元富79售02
736018 ,大江凱基7A購01
735028 ,應華凱基78購01
733962 ,富喬元大78購01
734509 ,博智元富77購02
734835 ,元太富邦78購01
735986 ,神準元富7A購01
733381 ,元太富邦75購02
70803P ,聯亞元大79售02
70656P ,網家群益77售01
733441 ,統新永豐75購01
735811 ,中美晶統一7B購02
735921 ,環球晶凱基7A購02
70546P ,環球晶統一75售04
734328 ,智擎康和77購01
735226 ,群聯群益7A購01
70411P ,合晶凱基74售03
6233 ,旺玖
732760 ,晶焱元大75購01
